[
  {"team_name": "Team Rocket",  "judge_name": "Alice", "technical": 8, "innovation": 7, "impact": 6, "presentation": 8},
  {"team_name": "Team Rocket",  "judge_name": "Bob",   "technical": 7, "innovation": 8, "impact": 7, "presentation": 7},
  {"team_name": "Byte Bandits", "judge_name": "Alice", "technical": 9, "innovation": 9, "impact": 8, "presentation": 9},
  {"team_name": "Byte Bandits", "judge_name": "Bob",   "technical": 8, "innovation": 8, "impact": 9, "presentation": 8}
]
